Question,Question Type,Answer Option 1,Explanation 1,Answer Option 2,Explanation 2,Answer Option 3,Explanation 3,Answer Option 4,Explanation 4,Answer Option 5,Explanation 5,Answer Option 6,Explanation 6,Correct Answers,Overall Explanation,Domain
A company runs a web application in Azure that experiences fluctuating traffic. They want the platform to automatically add or remove identical virtual machines to handle changes in demand without manual intervention. Which capability of Azure Virtual Machine Scale Sets supports this?,multiple-choice,Automatic scaling of VM instances based on metrics or schedules,"VM Scale Sets allow you to deploy and manage identical VMs that automatically scale out or in based on demand (CPU, memory, or schedules).",Built-in graphical interface for VM administration,Incorrect — management through a GUI is not the defining feature of automatic scaling in Scale Sets.,"Restriction to a small, fixed number of virtual machines",Incorrect — Scale Sets can scale to hundreds or thousands of instances.,Manual provisioning and management of each virtual machine,Incorrect — Scale Sets automate creation and management; manual creation defeats the purpose of the service.,,,,,1,"Azure Virtual Machine Scale Sets automatically scale the number of identical VM instances, making them ideal for variable workloads.",Azure Architecture and Services
"In Azure, a subscription can be placed inside another subscription to create a nested billing and management structure.",multiple-choice,TRUE,Azure does not support subscription-within-subscription architecture.,FALSE,"Subscriptions cannot be nested. To create hierarchy and apply governance across multiple subscriptions, Azure uses Management Groups.",,,,,,,,,2,Azure subscriptions cannot be nested. Use Management Groups to organize and govern multiple subscriptions.,Azure Management and Governance
An organization wants to plan its cloud budget in advance and ensure it can reliably estimate how much it will spend on Azure services over the coming months. What does cost predictability in Azure primarily refer to?,multiple-choice,Preventing all unexpected charges,"Incorrect — Azure can help reduce surprises, but usage spikes can still occur.",Assigning costs to departments using tags,"This is cost allocation, not predictability.",Accurately forecasting future cloud spending,Cost predictability means being able to estimate and forecast future Azure expenses using tools like the Pricing Calculator and Budgets.,Continuously lowering costs as usage grows,"This relates to cost optimization, not predictability.",,,,,3,"Cost predictability in Azure is about accurately forecasting future expenses, enabling better budgeting and financial planning.",Cloud Concepts
"An organization plans to store extremely large volumes of unstructured data—such as images, backups, and logs—in a single Azure Storage account and is concerned about hitting a maximum size limit. What is the maximum amount of data that can be stored in one Azure Storage account?",multiple-choice,5 TB,Too small — Azure Storage far exceeds terabyte-scale limits.,5 PB,"While Azure supports petabyte-scale storage, the exam does not define a hard cap like this for single accounts.",100 TB,Incorrect — Azure Storage accounts can store much more than 100 TB.,Azure Storage accounts have no practical storage limit,"From an AZ-900 perspective, Azure Storage accounts scale automatically and are treated as having no fixed maximum storage limit.",,,,,4,"From an AZ-900 perspective, Azure Storage accounts scale automatically and are considered to have no fixed maximum storage limit.",Azure Architecture and Services
"A company needs to store compliance data that is rarely accessed, can tolerate hours of retrieval latency, and must be kept at the lowest possible cost. Which Azure Storage access tier is most appropriate?",multiple-choice,Hot access tier,Optimized for frequently accessed data with high storage costs.,Cool access tier,For data stored for at least 30 days and accessed infrequently. More expensive than Archive for long-term storage.,Archive access tier,Designed for rarely accessed data with the lowest storage cost. It has a 180-day minimum retention and high retrieval latency (hours).,Premium storage,"Designed for high-performance workloads (SSDs). Most expensive option, not for archival.",,,,,3,"Use the Archive access tier for rarely accessed, long-term data that can tolerate higher retrieval latency and must be stored for at least 180 days.",Azure Architecture and Services
An organization's VMs automatically scale out during peak hours and scale back in when demand drops without manual intervention. Which cloud manageability benefit is this?,multiple-choice,Management of the cloud,"Refers to the tools you use (Portal, CLI) to manage resources manually.",Management in the cloud,"Refers to capabilities where the cloud platform automatically manages and optimizes resources for you, like autoscaling.",,,,,,,,,2,"Management in the cloud means Azure automatically manages and optimizes resources for you, such as autoscaling based on demand.",Cloud Concepts
An administrator wants to ensure users can perform only the tasks required for their role and nothing more. Which RBAC practice best supports this?,multiple-choice,Assigning users the Owner role to avoid permission issues,Incorrect — this grants excessive permissions and increases security risk.,Granting users only the permissions they need to complete their job,"This is the Principle of Least Privilege, a core security best practice that limits access to exactly what is needed.",Giving all users the same role for consistency,Incorrect — roles should be tailored to specific job responsibilities.,Temporarily disabling user accounts after each login,Incorrect — this is impractical and unrelated to access scope control.,,,,,2,"The principle of least privilege ensures users have only the access they need, reducing security risks in Azure environments.",Azure Management and Governance
A design uses a queue to let one component place work items and another process them later independently. The sender does not wait for the receiver. What type of communication is this?,multiple-choice,Synchronous communication,Requires the sender to wait for an immediate response from the receiver.,Real-time communication,"Implies instant, low-latency interaction like live chat.",Asynchronous communication,"The sender and receiver are decoupled; messages are stored until processed, allowing independent scaling.",Broadcast communication,Typically involves sending one message to many recipients simultaneously.,,,,,3,"Azure Queue Storage enables asynchronous communication, allowing application components to work independently and reliably.",Azure Architecture and Services
Which of the following are security-related benefits of moving workloads to Azure? (Select 3),multi-select,Built-in compliance with global and industry security standards,"Azure complies with global standards (ISO, GDPR, HIPAA), reducing the compliance burden on customers.",Centralized visibility and monitoring of security posture,Tools like Microsoft Defender for Cloud provide a single view of threats and risks.,Automatic security updates and patching of underlying infrastructure,"Microsoft manages the patching of physical hosts and infrastructure, reducing operational risk.",The ability to completely disable encryption for cloud-managed services,"Incorrect — cloud security best practices and Azure defaults emphasize encryption, not disabling it.",,,,,"1,2,3","Cloud platforms like Azure enhance security through built-in compliance, centralized monitoring, and automatic patching of the underlying infrastructure.",Azure Management and Governance
A company needs to migrate hundreds of terabytes of data to Azure but has limited bandwidth. Which are valid use cases for Azure Data Box? (Select 3),multi-select,Migrating very large datasets to Azure when network transfer is impractical,Data Box is designed for terabyte/petabyte scale migrations where WAN transfer is too slow.,Secure offline data transfer using Microsoft-managed physical devices,It uses encrypted hardware and secure shipping to move data without using the public internet.,Continuous real-time synchronization of application data,"Incorrect — Data Box is for one-time or periodic bulk moves, not real-time sync.",Data import/export to Azure Storage without relying on high-speed internet,It allows users to copy data locally to a device and ship it to an Azure datacenter for upload.,,,,,"1,2,4","Azure Data Box is ideal for secure, offline transfer of very large datasets when network-based migration is not practical.",Azure Architecture and Services
An architect is designing for redundancy. Which of the following describe this concept in Azure? (Select all that apply),multi-select,Maintaining multiple copies of data or resources to prevent a single point of failure,"Redundancy involves duplicating components so that if one fails, others are available.",Deploying resources across different fault domains or availability zones,Distribution across isolated hardware or datacenters ensures the service survives localized failures.,Using only one highly reliable instance of a resource to avoid complexity,Incorrect — a single instance is a single point of failure.,Replicating resources so services can continue operating during failures,Replication ensures that backup instances can take over immediately during a component failure.,,,,,"1,2,4",Redundancy in Azure means duplicating resources across isolated locations so services remain available even when failures occur.,Azure Architecture and Services
How does Azure Policy help manage Azure resources? (Select all that apply),multi-select,It enforces organizational standards by evaluating resource configurations,Policies define rules (like allowed VM sizes) that resources must follow.,It can prevent non-compliant resources from being created,"Using a 'Deny' effect, Azure Policy stops any deployment that violates defined rules.",It provides automatic scaling of resources based on workload demand,"Incorrect — scaling is managed by VM Scale Sets or App Service autoscale, not Policy.",It helps assess compliance and report on policy violations,Policy provides dashboards to track the compliance state of all resources in a subscription.,,,,,"1,2,4",Azure Policy enforces governance by defining and evaluating rules that control how Azure resources are created and configured.,Azure Management and Governance
A retail site experiences traffic spikes. Azure automatically adds compute during peak and releases it when traffic drops. Which cloud characteristics are these? (Select all that apply),multi-select,Scalability,The general ability of a system to handle increased/decreased workloads by adjusting resources.,Elasticity,The specific ability to scale resources automatically and dynamically in real-time based on demand.,High availability,"Refers to minimizing downtime and handling failures, not necessarily traffic-based scaling.",Predictability,"Relates to forecasting costs or performance, not dynamic resource adjustment.",,,,,"1,2","Automatic scaling up and down based on demand demonstrates scalability, and when automated, specifically demonstrates elasticity.",Cloud Concepts
A legacy Windows app requires full admin access to the OS and must write to the Windows Registry. Which model supports this?,multiple-choice,Infrastructure as a Service (IaaS),"IaaS (VMs) provides full control over the OS, allowing custom configurations and registry access.",Platform as a Service (PaaS),"In PaaS, Azure manages the OS; users generally cannot access the registry or OS internals.",Software as a Service (SaaS),SaaS provides only the end application; there is no access to the underlying infrastructure.,Serverless computing,Serverless (Functions) abstracts the OS completely and is for short-running code only.,,,,,1,"If an application requires direct operating system access, such as writing to the Windows Registry, IaaS is the only suitable cloud model.",Cloud Concepts
"A team wants to deploy web apps without managing the OS, runtime patching, or infrastructure. Which of the following are examples of Platform as a Service (PaaS)? (Select all that apply)",multi-select,Azure App Service,A classic PaaS offering where Azure manages the OS and runtime while developers focus on code.,Azure SQL Database,A PaaS database service that handles automatic backups and patching without requiring server maintenance.,Azure Virtual Machines,Incorrect — Virtual Machines are IaaS. You are responsible for the OS and patching.,Azure Functions,A serverless PaaS offering that allows you to focus purely on code execution without infrastructure management.,,,,,"1,2,4","PaaS services abstract infrastructure and OS management, allowing developers to focus on building and deploying applications.",Cloud Concepts
An administrator is preparing to deploy a new Windows VM. Which of the following are mandatory requirements to create an Azure Virtual Machine? (Select all that apply),multi-select,An Azure subscription,All resources must belong to a subscription for billing and management boundaries.,A resource group,Every Azure VM must be placed inside a resource group to act as a logical container.,A virtual network,A VM must be connected to a virtual network (VNet) for communication.,An Azure availability zone,Incorrect — Availability Zones are optional. They improve resiliency but are not required for creation.,,,,,"1,2,3","To create an Azure Virtual Machine, you must have a subscription, a resource group, and a virtual network. Availability Zones are optional.",Azure Architecture and Services
"Azure Virtual Network (VNet) peering allows two virtual networks to communicate privately, even if those VNets are owned by different Azure subscriptions or Entra ID tenants.",multiple-choice,TRUE,Azure VNet Peering supports cross-subscription and cross-tenant connectivity over the private Azure backbone network.,FALSE,Incorrect — VNet peering is not limited to a single subscription or tenant.,,,,,,,,,1,"Azure VNet peering can connect networks across different subscriptions and even different tenants, using private Azure networking.",Azure Architecture and Services
External users need secure access to selected Azure resources but should use their own organization's identities. Which scenarios are supported by Azure B2B? (Select all that apply),multi-select,Allowing external partner users to access Azure resources using their own credentials,B2B allows partners to sign in using their existing Microsoft Entra or other identity provider accounts.,Enabling guest users from other organizations to be assigned Azure RBAC roles,Guest users can be added to groups and assigned specific permissions just like internal users.,Providing identity management exclusively for internal employees,"Incorrect — this is the role of standard Entra ID internal accounts, not B2B collaboration.",Collaborating with external users without creating separate user accounts in your directory,B2B avoids identity duplication by leveraging the user's existing external account.,,,,,"1,2,4","Azure B2B collaboration enables secure access for external users using their own identities, without creating separate internal accounts.",Azure Architecture and Services
Which statements about Azure App Service Plans (Premium v3) are correct? (Select all that apply),multi-select,A single App Service Plan can host multiple web apps,An App Service Plan defines the compute resources that multiple apps can share.,There is a hard limit of 10 web apps per App Service Plan,Incorrect — there is no fixed hard limit of 10 apps; it is constrained by resource performance.,The number of web apps is not strictly limited by the plan itself,"From an AZ-900 perspective, the number of apps is effectively unlimited, limited only by CPU and memory.",All apps in the same App Service Plan share the underlying compute resources,All apps on a plan run on the same VM instances and compete for the same hardware resources.,,,,,"1,3,4",An Azure App Service Plan can host multiple apps which share the same underlying compute resources.,Azure Architecture and Services
An administrator wants to assign predefined permissions without creating custom roles. Which of the following are built-in Azure RBAC roles? (Select all that apply),multi-select,Reader,Can view Azure resources but cannot make any changes.,Contributor,Can create and manage Azure resources but cannot assign roles to others.,Owner,"Full access to all resources, including the ability to assign RBAC roles to others.",User,"Incorrect — 'User' is an identity type, not a specific built-in RBAC role.",,,,,"1,2,3","Reader, Contributor, and Owner are the core built-in Azure RBAC roles.",Azure Management and Governance
What are the primary purposes of implementing Single Sign-On (SSO)? (Select all that apply),multi-select,Allow users to authenticate once and access multiple applications,SSO allows one-time authentication for multiple cloud and SaaS apps.,Reduce password fatigue and repeated sign-in prompts,SSO limits the number of passwords users must remember and manage.,Automatically enforce multi-factor authentication for all users,Incorrect — MFA is a separate security feature configured via Conditional Access.,Improve user productivity by simplifying the sign-in experience,Streamlining the login process reduces friction and improves the overall user experience.,,,,,"1,2,4","Single Sign-On enables users to access multiple applications with one authentication, improving usability and productivity.",Azure Architecture and Services
How can Azure tags help with cost optimization? (Select all that apply),multi-select,"Grouping and categorizing resources by department, project, or environment for cost analysis",Tags allow metadata to be added to resources so costs can be categorized logically.,Enabling detailed cost reporting and chargeback using Azure Cost Management,Cost Management can filter reports by tag to see which department is spending what.,Automatically turning off idle or underutilized resources,Incorrect — tags are metadata; they do not perform actions like shutting down VMs.,Helping identify cost trends and optimization opportunities across tagged resources,Analyzing costs by tags helps spot high-cost projects that may need optimization.,,,,,"1,2,4","Tags optimize costs by enabling visibility and reporting, rather than by taking automated technical actions.",Azure Management and Governance
An enterprise runs a critical app with steady usage expected for 1–3 years. Which pricing options are best for this scenario? (Select all that apply),multi-select,Reserved Instances,"Ideal for predictable workloads, offering deep discounts for 1-year or 3-year commitments.",Pay-as-you-go,Incorrect — PAYG is best for unpredictable or short-term workloads and is more expensive long-term.,Azure Savings Plans for Compute,Provides flexible commitment-based savings across multiple compute services for steady workloads.,Spot Instances,Incorrect — Spot instances can be interrupted at any time and are not suitable for critical workloads.,,,,,"1,3","For predictable, long-term workloads, Reserved Instances and Savings Plans provide the best cost optimization.",Cloud Concepts
"In a public cloud model, who typically owns and manages the underlying physical IT infrastructure (servers, datacenters, etc.)?",multiple-choice,The customer who consumes the cloud services,Incorrect — customers use the infrastructure but do not own or maintain the hardware.,"The cloud service provider (for example, Microsoft Azure or Amazon AWS)","In public cloud, the provider is responsible for hardware maintenance, physical security, and datacenter operations.",,,,,,,,,2,"In cloud computing, the cloud provider owns and manages the physical IT infrastructure, while customers focus on using services.",Cloud Concepts
