Question,Question Type,Answer Option 1,Explanation 1,Answer Option 2,Explanation 2,Answer Option 3,Explanation 3,Answer Option 4,Explanation 4,Answer Option 5,Explanation 5,Answer Option 6,Explanation 6,Correct Answers,Overall Explanation,Domain
"An enterprise wants to apply governance policies and access controls across all Azure subscriptions in the organization using a single, top-level container. Which Azure construct represents the highest level in the Azure resource hierarchy?",multiple-choice,Resource,"Resources (VMs, VNets, databases) are the lowest level in the hierarchy.",Resource Group,Resource Groups organize resources but belong to a subscription.,Subscription,"Subscriptions are a billing and management boundary, but they can be grouped under Management Groups.",Management Group,"The Azure hierarchy (from highest to lowest) is: Management Group > Subscription > Resource Group > Resource. Management Groups sit at the top. They allow organizations to group multiple subscriptions, apply Azure Policy and RBAC centrally, and enforce governance at scale.",,,,,4,"Management Groups are the highest level in the Azure hierarchy, enabling centralized governance across multiple subscriptions.",Azure Architecture and Services
"An organization wants employees to securely access their Windows desktop and applications from anywhere, using devices such as laptops, tablets, or thin clients, without hosting desktops on on-premises infrastructure. Which Azure service is designed to meet this requirement?",multiple-choice,Azure App Service,"Used to host web applications and APIs, not full desktops.",Azure Virtual Machines,VMs provide compute infrastructure but do not by themselves deliver a managed desktop virtualization service.,Azure Virtual Desktop,"Azure Virtual Desktop (AVD) is used to: Deliver virtualized Windows desktops and applications. Allow users to access desktops from anywhere, on any device. Centralize desktop management and improve security. Support Windows 10/11 multi-session. It is a Desktop-as-a-Service (DaaS) offering.",Azure Kubernetes Service,"AKS is for container orchestration, not desktop delivery.",,,,,3,"Azure Virtual Desktop is designed to deliver secure, virtualized Windows desktops and applications to users from anywhere.",Azure Architecture and Services
"Azure architectures are designed so that when a single component (such as a VM, disk, or network device) fails, the overall service continues to operate with minimal disruption. What is the primary role of fault tolerance in Azure’s reliability strategy?",multiple-choice,To improve application performance during peak usage,"Performance optimization is related to scaling and tuning, not fault tolerance.",To completely eliminate all hardware and software failures,"Failures are inevitable. Fault tolerance is about handling failures gracefully, not preventing them.",To limit the impact of individual component failures on the overall system,"Fault tolerance focuses on: Designing systems with redundancy. Ensuring no single point of failure exists. Allowing workloads to continue running even if individual components fail. Examples include multiple VMs behind a load balancer and Availability Zones. The goal is continuity, not failure prevention.",To guarantee instant recovery from full regional outages,"This describes disaster recovery, not fault tolerance. Disaster recovery handles large-scale outages, such as region failures.",,,,,3,"Fault tolerance minimizes the impact of component failures by using redundancy and resilient design, ensuring continued operation.",Azure Management and Governance
"An administrator needs a fast, scriptable way to move large volumes of data between on-premises storage and Azure Blob Storage as part of a migration project. Which Azure tool is specifically designed for this task?",multiple-choice,Azure Storage Explorer,"A GUI tool for browsing and managing storage, but not optimized for large automated transfers.",AzCopy,"AzCopy is a command-line utility used to: Copy data to and from Azure Storage (Blob, File). Perform high-performance, parallel data transfers. Support scripting and automation for migrations and backups. It is optimized for large-scale data movement.",Azure Monitor,"Used for monitoring and logging, not data transfer.",Azure Resource Manager,"Used for deployment and management of resources, not moving data.",,,,,2,"AzCopy is the go-to Azure tool for fast, efficient data transfer to and from Azure Storage.",Azure Architecture and Services
"A cloud-hosted application experiences varying levels of demand throughout the day. During peak hours, additional resources are added to maintain performance, and during low usage periods, resources are reduced to save costs. Which cloud property does this scenario best demonstrate?",multiple-choice,High availability,"High availability focuses on minimizing downtime and ensuring services stay online, not on adjusting capacity.",Scalability,Scalability refers to: The ability of a system to handle increased or decreased workloads. Adding or removing resources (such as VMs or app instances) as demand changes. Maintaining performance as usage grows. This includes scaling out/in or scaling up/down.,Manageability,"Manageability refers to ease of administration, automation, and monitoring, not workload handling.",Predictability,"Predictability relates to forecasting performance or costs, not dynamic resource adjustment.",,,,,2,Scalability is the ability of a system to handle changing workloads by dynamically adjusting resources.,Cloud Concepts
"An organization needs to move hundreds of terabytes of data from its on-premises datacenter to Azure. Due to limited bandwidth and time constraints, transferring the data over the internet is not practical. Which Azure solution is specifically designed for this scenario?",multiple-choice,Azure Migrate,"Azure Migrate is used to assess and migrate servers and applications, not for large-scale physical data transfer.",Azure Import/Export via physical disks,This is a legacy approach and less commonly recommended compared to Azure Data Box for large-scale transfers.,Azure Data Box,Azure Data Box is a physical device provided by Microsoft that allows you to: Transfer very large volumes of data (TBs or PBs). Avoid slow or unreliable internet transfers. Securely ship data to and from Azure datacenters. Use it for one-time migrations or archival uploads.,AzCopy,"AzCopy transfers data over the network, which is not suitable for very large datasets with bandwidth limitations.",,,,,3,"When internet transfer is too slow or impractical, Azure Data Box provides a secure physical method to move massive amounts of data to and from Azure.",Azure Architecture and Services
"An operations team uses Azure CLI and ARM/Bicep templates to automatically deploy, update, and delete infrastructure resources as part of a CI/CD pipeline, without manually clicking through the Azure portal. This capability is best described as which type of manageability benefit?",multiple-choice,Management in the cloud,"Management in the cloud focuses on managing applications and data that run inside the cloud (monitoring, backups, updates).",Management of the cloud,"Management of the cloud refers to: Managing cloud resources themselves. Using automation, scripts, APIs, and Infrastructure as Code (IaC). Programmatically creating, modifying, or deleting resources. Examples include Azure CLI, ARM templates, Bicep, and Terraform.",,,,,,,,,2,Using scripts or templates to programmatically create and manage Azure resources is an example of management of the cloud.,Cloud Concepts
"An application is designed to store massive amounts of data in Azure. Over time, the data volume is expected to exceed the maximum capacity supported by a single Azure Storage account. What is the recommended approach to store more data beyond the limit of one storage account?",multiple-choice,Request Microsoft to increase the storage limit for the existing account,Azure does not increase the maximum storage capacity per account on request.,Create additional Azure Storage accounts and distribute the data across them,"Azure Storage accounts have service limits. When you need to store more data than a single account allows, the recommended solution is to create multiple storage accounts and partition or distribute data across those accounts. This is a common cloud design pattern.",Move the data to a different Azure region automatically,Changing regions does not increase the storage limit of a single account.,Azure does not support storage beyond the limit of a single account,"Azure supports virtually unlimited storage by using multiple storage accounts, not just one.",,,,,2,"When you exceed the capacity of a single Azure Storage account, the correct solution is to create additional storage accounts and partition your data across them.",Azure Architecture and Services
An organization wants its data to remain available even if one datacenter (availability zone) within an Azure region fails. The data should stay within a single region but be synchronously replicated across zones. Which Azure Storage redundancy option meets this requirement?,multiple-choice,Locally Redundant Storage (LRS),"Three copies, but all in a single datacenter. No protection against datacenter failure.",Zone-Redundant Storage (ZRS),Zone-Redundant Storage (ZRS): Stores three copies of data. Replicates synchronously across three availability zones. Keeps all data within a single Azure region. Protects against datacenter (zone) failures.,Geo-Redundant Storage (GRS),Replicates data to a secondary region. Does not distribute data across zones in the primary region.,Geo-Zone-Redundant Storage (GZRS),Combines ZRS + GRS. Replicates across zones and to a secondary region. This is more than what the question requires.,,,,,2,"If you want three copies of data spread across all availability zones in a single region, use Zone-Redundant Storage (ZRS).",Azure Architecture and Services
"Within an Azure Virtual Network (VNet), administrators often divide the address space into smaller segments to isolate workloads and apply different security rules. What is this logical network segment called?",multiple-choice,Network Security Group (NSG),An NSG is a security control that filters inbound and outbound traffic. It does not divide a network.,Subnet,"A subnet is a logical subdivision of an Azure Virtual Network that: Uses a portion of the VNet’s IP address range, allows you to group resources, and enables applying security controls and routing rules at a granular level.",Azure Firewall,"Azure Firewall is a managed network security service, not a network division.",Public IP address,"A public IP address provides internet connectivity, not network segmentation.",,,,,2,"A subnet is the logical division of an Azure Virtual Network, used to organize and secure networked resources.",Azure Management and Governance
An administrator is configuring Microsoft Entra Conditional Access to control how users sign in to cloud applications. Which of the following are NOT valid conditions that can be evaluated in a Conditional Access policy?,multiple-choice,User risk level,Derived from Microsoft Entra Identity Protection. Can trigger actions like MFA or blocking access. This is a valid condition.,"Application category (for example, productivity vs finance apps)","Conditional Access can target specific applications or all cloud apps. However, it cannot evaluate “application type or category” (such as finance vs HR). This makes it the correct answer for what is NOT a valid condition.",Geographic location of the sign-in,"Uses named locations (country, region, IP range). Commonly used to block risky sign-ins. This is a valid condition.","Device platform (for example, Windows, iOS, Android)","Conditional Access can evaluate Windows, macOS, iOS, and Android platforms. This is a valid condition.",,,,,2,"Conditional Access evaluates user, device, location, risk, and app access—but not application “categories” or types.",Azure Management and Governance
Your company is designing a highly available solution in Azure and is considering using Availability Zones within a region. Which of the following statements about Azure Availability Zones are TRUE? (Select all that apply),multi-select,Availability Zones consist of one or more physically separate datacenters within the same Azure region.,"Availability Zones are physically separate locations within a single Azure region, designed to improve availability and resilience.","Each Availability Zone has independent power, cooling, and networking.","Each zone is isolated with independent power, cooling, and networking. This isolation prevents a single datacenter failure from impacting other zones.",Availability Zones automatically replicate data across different Azure tenants.,"Availability Zones have nothing to do with Azure tenants. Tenants are identity boundaries, not infrastructure boundaries.",Availability Zones help protect applications from datacenter-level failures.,"By distributing resources across zones, Azure helps protect workloads from datacenter outages and localized power issues.",,,,,"1,2,4",Availability Zones improve resiliency by distributing resources across physically separate datacenters within the same region.,Azure Architecture and Services
"An organization operates under strict regulatory and compliance requirements, such as government regulations or industry-specific standards. It needs strong control over data location, access, and security. Which cloud deployment models are commonly used in such scenarios? (Select all that apply)",multi-select,Public Cloud,"While public cloud offers strong compliance, pure public cloud is not typically the first choice when absolute isolation is required.",Private Cloud,"Used when an organization requires full control over infrastructure and data must remain on dedicated, isolated hardware.",Community Cloud,"Designed for multiple organizations with shared compliance needs (e.g., government departments) and shared infrastructure governed by mutual standards.",Hybrid Cloud,"Hybrid cloud is an architecture approach to extend systems, not a cloud model specifically chosen for compliance by itself.",,,,,"2,3","Private Cloud and Community Cloud are commonly chosen when strict compliance, regulatory control, and data isolation are required.",Cloud Concepts
"An organization wants to pay only for the resources it actually uses, scaling costs up and down dynamically based on demand, without upfront hardware investment. Which cloud deployment models typically support a consumption-based (pay-as-you-go) pricing model? (Select all that apply)",multi-select,On-premises,Requires upfront capital expenditure (CapEx) and fixed hardware costs regardless of usage.,Public Cloud,"Public cloud platforms charge based on actual consumption (compute hours, storage) and allow rapid scaling without upfront investment.",Private Cloud,"Private clouds involve dedicated hardware where costs are usually fixed or capacity-based, not truly consumption-based.",Hybrid Cloud,"The cloud portion of a hybrid model still uses consumption-based pricing, allowing organizations to burst into the public cloud and pay only when used.",,,,,"2,4",Consumption-based pricing is a core characteristic of public cloud and applies to the cloud portion of hybrid cloud deployments.,Cloud Concepts
A development team builds an event-driven application where traffic patterns are highly unpredictable. Which benefits of serverless computing make it well suited for this scenario? (Select all that apply),multi-select,Automatic scaling based on incoming demand,Serverless platforms (like Azure Functions) automatically scale up with demand and down to zero when there is no traffic.,Pay only for execution time and resources consumed,"You are billed only when code runs. No charges when the app is idle, reducing costs for bursty workloads.",No need to provision or manage servers,"The cloud provider manages infrastructure, OS, and scaling. Developers focus only on code.",Guaranteed fixed monthly pricing regardless of usage,"Serverless does not use fixed pricing; billing is consumption-based, which is the opposite of fixed cost.",,,,,"1,2,3","Serverless computing is ideal for unpredictable workloads because it automatically scales, eliminates server management, and charges only for actual usage.",Azure Architecture and Services
An administrator is provisioning storage for Azure Virtual Machines and needs block-level storage volumes that can be attached directly to VMs and are fully managed by Azure. Which Azure storage options meet this requirement? (Select all that apply),multi-select,Azure Managed Disks,"Block-level storage designed specifically for VMs, used as OS or data disks, and fully managed by Azure.",Azure Blob Storage,Object storage used for unstructured data. Cannot be attached as a VM disk.,Azure Ultra Disks,"A high-performance type of managed disk for IO-intensive workloads, attached directly to VMs.",Azure File Storage,Provides file-level storage via SMB/NFS. Not block-level VM disks.,,,,,"1,3",Azure Managed Disks (including Ultra Disks) provide block-level storage volumes that are attached directly to Azure Virtual Machines.,Azure Architecture and Services
"A development team wants to deploy applications without worrying about operating system installation, patching, or version selection. Which cloud service models meet this requirement? (Select all that apply)",multi-select,Platform as a Service (PaaS),"The cloud provider manages the OS. You focus on application code and configuration (e.g., Azure App Service).","Serverless computing (for example, Azure Functions)",The OS is completely abstracted away. Scaling and patching are fully managed by Azure.,Infrastructure as a Service (IaaS),You choose the OS and are responsible for patching and updates.,Virtual Machines,An IaaS offering where you select the OS image and manage configuration/updates.,,,,,"1,2","If you do not want to manage or control the operating system, choose PaaS or Serverless. If you need OS-level control, choose IaaS.",Cloud Concepts
"An organization stores data across Azure, on-premises, and other clouds. They want a single solution to discover, classify, and apply policies. Which capabilities are provided by Microsoft Purview? (Select all that apply)",multi-select,Centralized data discovery and classification across multiple data sources,"Purview helps discover and catalog data across Azure, on-premises, multi-cloud, and SaaS automatically.",Unified data governance and compliance management,Purview enables policy enforcement and compliance tracking across the organization.,Automatic scaling and performance optimization of Azure virtual machines,"This is handled by Azure Monitor and Advisor, not Purview.",Data sensitivity labeling and compliance reporting,Purview supports sensitivity labels and compliance reports to meet regulatory requirements.,,,,,"1,2,4","Microsoft Purview provides unified data governance, discovery, classification, and compliance across cloud, on-premises, and SaaS data sources.",Azure Management and Governance
"An application hosted in Azure must remain accessible even if hardware, a datacenter, or an entire availability zone fails. Which design approaches help achieve high availability? (Select all that apply)",multi-select,Deploying resources across multiple Availability Zones,Protects applications from datacenter-level failures using physically separate locations.,Replicating services or data across regions or zones,"Ensures another copy is available if one fails (e.g., Geo-redundant storage).",Designing the system with no single points of failure,"Requires redundancy at compute, storage, and networking layers along with load balancing.",Reducing infrastructure costs to free up capacity,Cost optimization is not directly related to minimizing downtime or high availability.,,,,,"1,2,3","High availability minimizes downtime by using redundancy, replication, and designs that eliminate single points of failure.",Azure Management and Governance
An administrator needs full control over Azure resources and must also be able to assign roles to other users so they can manage access. Which responsibilities are included with the Azure RBAC Owner role? (Select all that apply),multi-select,Full management access to Azure resources,"The Owner role provides complete control over resources, including the ability to create, modify, and delete any Azure resource.",Ability to assign and remove Azure RBAC role assignments,"Unlike the Contributor role, Owners have the permission to delegate access by assigning or removing roles for other users.",Read-only access to Azure resources,"Read-only access is a specific limitation of the 'Reader' role. While an Owner can see everything, their primary purpose is full control, not just reading.",Monitoring Azure resources for security threats,"Monitoring is a function of services like Microsoft Defender or Azure Monitor, not a specific permission of the RBAC Owner role.",,,,,"1,2","The Owner role allows full resource management and the ability to delegate access, making it the most powerful built-in Azure RBAC role.",Azure Management and Governance
An application is deployed on multiple Azure virtual machines within the same Availability Set. The VMs are spread across multiple update domains. What types of issues do update domains help protect against? (Select all that apply),multi-select,Planned maintenance downtime,"Update Domains ensure that when Microsoft performs planned maintenance (like host OS updates), only a portion of the VMs are rebooted at once.",Operating system patching events,Platform-initiated OS patching is rolled out sequentially across update domains to prevent application-wide downtime.,Unplanned hardware failures,"Unplanned failures (power, hardware, network) are handled by Fault Domains, not Update Domains.",Simultaneous VM reboots during updates,"By design, only one update domain is updated at a time, preventing all VMs in a set from rebooting simultaneously.",,,,,"1,2,4","Update Domains protect against planned downtime by ensuring Azure updates and reboots VMs in stages, rather than all at once.",Azure Architecture and Services
"Certain organizations, such as government agencies and regulated industries, must meet strict legal, regulatory, and data residency requirements. What are the primary purposes of Azure Sovereign Regions? (Select all that apply)",multi-select,To ensure customer data remains within a specific country or jurisdiction,Sovereign regions (like Azure China or Azure Government) provide strict data residency boundaries to comply with local laws.,"To meet government, regulatory, and compliance requirements",These regions are specifically audited and built to meet the high-security standards required by government and industry regulations.,To provide discounted Azure services to local customers,Sovereign regions often cost more due to the extra compliance and isolation overhead; they are not intended for discounts.,To operate Azure services in isolated environments with restricted access,These regions are physically and logically isolated from the public Azure global network and have restricted access lists.,,,,,"1,2,4","Azure Sovereign Regions meet strict data residency and compliance needs by operating in isolated, jurisdiction-specific environments.",Cloud Concepts
Which is the lowest-cost storage option among the listed Azure disk types?,multiple-choice,Ultra Disks,"The most expensive option, offering sub-millisecond latency for the most demanding workloads.",Standard SSDs,Moderately priced; better performance than HDD but more expensive.,Premium SSDs,High-cost storage designed for production and I/O-intensive mission-critical applications.,Standard HDDs,The lowest-cost managed disk option. It offers the lowest performance and is best for backups or non-critical testing.,,,,,4,"Standard HDDs provide the most cost-effective storage by using traditional hard disk technology, suitable for non-performance-critical data.",Azure Architecture and Services
An application uses Azure Virtual Machine Scale Sets (VMSS) to scale based on demand. How is incoming network traffic distributed to the virtual machines in a VMSS? (Select all that apply),multi-select,VM Scale Sets automatically distribute traffic without any additional configuration,VMSS handles the scaling of VMs but does not perform traffic distribution itself; an external load balancer is required.,An Azure Load Balancer can be used to distribute traffic across VM instances,This is the standard Layer 4 solution that automatically updates its backend pool as VMSS instances scale in or out.,Azure Application Gateway can be used to distribute HTTP/HTTPS traffic to VM instances,"This Layer 7 solution is ideal for web apps, offering URL-based routing and WAF support for VMSS instances.",Traffic distribution must be handled manually by configuring DNS round-robin only,DNS round-robin is inefficient for scaling events; Azure's automated load balancing services are the recommended approach.,,,,,"2,3","VM Scale Sets handle scaling, but traffic distribution requires a load-balancing service like Azure Load Balancer or Application Gateway.",Azure Architecture and Services
