Question,Question Type,Answer Option 1,Explanation 1,Answer Option 2,Explanation 2,Answer Option 3,Explanation 3,Answer Option 4,Explanation 4,Answer Option 5,Explanation 5,Answer Option 6,Explanation 6,Correct Answers,Overall Explanation,Domain
Your organization uses several cloud-based business applications. Employees currently have to enter their username and password separately for each application. The IT department wants to streamline access so users authenticate once and then seamlessly access all approved apps. Which Azure service provides this capability?,multiple-choice,Microsoft Entra ID Single Sign-On (SSO),Microsoft Entra ID Single Sign-On (SSO) is the specific capability within Microsoft Entra ID that enables this seamless access across multiple applications after a single initial authentication.,Azure Monitor,"This service is used for collecting, analyzing, and acting on telemetry data from your cloud and on-premises environments. It is a monitoring and logging tool, not an identity and access management service.",Azure Information Protection,"This service is focused on classifying, labeling, and protecting documents and emails. It deals with data protection, not the user authentication process itself.",Azure Virtual Network Peering,"This is a networking service that connects two Azure Virtual Networks (VNet) in the same or different regions, allowing traffic to flow between them privately. It is completely unrelated to user identity and application access.",,,,,1,"The problem describes the need for Single Sign-On (SSO), which is an authentication method that allows users to log in with a single set of credentials and gain access to multiple applications without re-entering credentials. Microsoft Entra ID is the central authority for managing user identities and access to cloud applications.",Azure Management and Governance
"Your team is deploying an application that uses an Azure Storage account. The application accesses the storage account using account access keys. According to the Azure shared responsibility model, who is responsible for protecting and securely storing these keys?",multiple-choice,The customer (you) is responsible for securing the access keys,"Under the Azure shared responsibility model, customers are responsible for securing data, identities, and access keys. You must store keys securely, rotate them when needed, and use tools like Key Vault or Managed Identities to avoid exposure.",Microsoft Azure is responsible for securing the access keys,"Azure protects the infrastructure, but not your specific account keys. Azure generates the keys, but the customer must secure them.",Microsoft Support is responsible for rotating the access keys automatically,Microsoft Support does not rotate your keys or manage your credentials. Key rotation is entirely a customer responsibility.,The Azure Security Center automatically protects the access keys without customer involvement,"Microsoft Defender for Cloud can recommend best practices or alert you if keys are exposed, but it does not store, rotate, or enforce access protection for you.",,,,,1,"Under the Azure shared responsibility model, Microsoft is responsible for securing the platform infrastructure, while customers are responsible for securing their data, identities, and credentials like storage access keys.",Azure Management and Governance
Your organization wants to deploy applications as close as possible to end users around the world. They are comparing major cloud providers and want the one with the largest number of publicly available regions for provisioning compute and storage resources. Which cloud provider currently has the broadest global footprint of public cloud regions?,multiple-choice,Amazon Web Services (AWS),"AWS has a large global presence, but fewer public regions than Microsoft Azure. Even though AWS has many availability zones, the region count is the specific metric here.",Microsoft Azure,"Microsoft Azure has the largest number of publicly available cloud regions globally among major cloud providers, providing more geographic deployment options and data residency flexibility.",Google Cloud Platform (GCP),"GCP continues to expand, but its region count remains well below Azure and AWS.",Oracle Cloud Infrastructure (OCI),OCI has been rapidly growing but does not yet match the global scale and region count of Azure.,,,,,2,"Microsoft Azure consistently maintains the highest number of public cloud regions worldwide compared to other major providers, offering the broadest choice for global deployment.",Cloud Concepts
"An IT engineer wants to manage Azure virtual machines, storage, and networking resources using a browser-based graphical interface instead of scripting or command-line tools. Which Azure tool should they use?",multiple-choice,Azure Portal,"Azure Portal is a web-based graphical interface accessible through any browser. It allows users to create, view, and manage Azure resources visually—ideal for those who prefer GUI-based management instead of command-line tooling.",Azure PowerShell,"This is a command-line automation tool, not GUI. It requires script-based operations, which the administrator specifically wants to avoid.",Azure CLI,"Azure CLI is also command-line based, often used in terminals or scripts. Even though it can run in the Cloud Shell, it still requires typing commands.",Azure Resource Manager (ARM) Templates,"ARM templates are JSON-based deployment files, used for infrastructure-as-code. They are not a graphical interface and require authoring configurations manually.",,,,,1,"Azure Portal is the primary graphical, browser-based interface for managing Azure resources—ideal for admins who prefer GUI over command-line tools.",Azure Architecture and Services
Your organization wants actionable suggestions to optimize cloud spending. They need an Azure service that analyzes resource usage and provides personalized recommendations to help lower costs across their subscription. Which Azure service should they use?,multiple-choice,Azure Monitor,"Azure Monitor collects logs, metrics, and telemetry. It does not provide personalized cost-saving recommendations.",Azure Advisor,"Azure Advisor evaluates your deployed resources and provides personalized best-practice recommendations, including: · cost-saving opportunities · performance improvements · reliability enhancements · security suggestions. For cost optimization specifically, Advisor identifies underutilized VMs, idle resources, and better pricing options.",Azure Cost Management exports,"Cost Management helps analyze spending and view detailed reports, but exports only provide raw cost data. It does not generate personalized recommendations for optimization.",Azure Resource Graph,"Resource Graph allows you to query and explore Azure resources at scale. It provides inventory and metadata, not cost-reduction advice.",,,,,2,Azure Advisor is the Azure service that provides personalized cost-saving recommendations to help optimize your cloud spending.,Azure Architecture and Services
"A company uses a single Microsoft Entra ID tenant for identity. Different departments want separate billing, independent access control, and isolated usage quotas for their Azure workloads—all while staying under the same corporate tenant. What should the company create?",multiple-choice,Separate Azure tenants for each department,"Separate tenants isolate identity, users, and policies, creating unnecessary silos. The requirement is separation within the same organization, not separate identity boundaries.",Multiple subscriptions within the same tenant,"Multiple Azure subscriptions allow organizations to: · separate billing · define distinct access permissions · set resource usage limits/quotas · isolate environments (e.g., HR, Finance, Dev, Prod). Subscriptions are the correct boundary for billing and resource governance within one Microsoft Entra tenant.",Additional resource groups for each department,"Resource groups help with organizational grouping and RBAC scoping, but they: · do not separate billing · do not provide independent quotas · are contained inside a subscription. So they cannot achieve the needed isolation.",A single subscription with multiple management groups,"Management groups sit above subscriptions, not inside them. They help apply policies across subscriptions, not separate billing or limits within a subscription.",,,,,2,"Use multiple Azure subscriptions under one Microsoft Entra tenant when you need billing separation, access isolation, and independent resource limits for different business units.",Azure Architecture and Services
"Your organization wants to centralize log and telemetry data collected from virtual machines, applications, and other Azure services. They need to know which Azure component acts as the container that stores this log data for querying and analysis. Which Azure component should they use?",multiple-choice,Log Analytics Workspace,"A Log Analytics Workspace is the primary container used by Azure Monitor to: · collect telemetry (logs, metrics, traces) · store the data centrally · run Kusto Query Language (KQL) queries · enable insights, alerts, and dashboards. Every Azure Monitor Logs deployment requires at least one workspace.",Azure Storage Account (Blob Storage),"While some diagnostic logs can be exported to storage for archival, it is not the default container for Azure Monitor Logs. It does not support KQL querying or analytics.",Azure Monitor Alerts,"Alerts consume log and metric data, but they do not store logs. They simply trigger notifications or actions based on conditions.",Azure Data Lake Storage,Data Lake is used for big data analytics and storage of large datasets. It is not the container used by Azure Monitor to store telemetry logs.,,,,,1,A Log Analytics Workspace is the core storage and query container for Azure Monitor log data.,Azure Architecture and Services
"An administrator prefers to manage Azure resources visually rather than using command-line tools. They want to use the main graphical user interface provided by Microsoft to create, modify, and monitor Azure resources. Which tool should they use?",multiple-choice,Azure Portal,"Azure Portal is the primary web-based graphical interface for managing Azure services. It allows users to deploy, monitor, and configure resources from a browser without needing scripts or command-line tools.",Azure PowerShell,This is a command-line scripting tool. It is powerful for automation but not a graphical interface.,Azure CLI,"Also a command-line tool, used in terminals or scripts. Not GUI-based.",Azure Storage Explorer,"A graphical tool, but only for managing storage accounts (blobs, files, queues, tables). It cannot manage all Azure resources like VMs, networking, databases, policies, or monitoring.",,,,,1,"Azure Portal is the main GUI for managing Azure resources, ideal for users who prefer visual over command-line management.",Azure Architecture and Services
"Your company wants to process large volumes of data using a managed Hadoop ecosystem in Azure. They need a service that supports open-source frameworks such as Hadoop, Spark, Hive, and HBase, without having to manage the underlying infrastructure. Which Azure service should they use?",multiple-choice,Azure Kubernetes Service (AKS),AKS is a managed Kubernetes environment used for container orchestration. It does not provide managed Hadoop clusters or big data processing frameworks out of the box.,Azure Synapse Pipelines,"Synapse Pipelines provide data orchestration (ETL/ELT), not a managed Hadoop-based compute environment.",Azure HDInsight,"Azure HDInsight is Microsoft’s managed Apache Hadoop-based service for big data analytics. It supports a variety of open-source frameworks, including: · Hadoop · Spark · Hive · HBase · Kafka. It abstracts infrastructure management so organizations can focus on processing and analyzing data.",Azure Batch,Azure Batch is for large-scale parallel and batch compute jobs. It does not natively support Hadoop or related frameworks.,,,,,3,Azure HDInsight is the Azure service that offers a fully managed Hadoop-based platform for running big data analytics workloads using popular open-source technologies.,Azure Architecture and Services
"An engineering team wants to deploy their custom application code to Azure. They do not want to manage virtual machines, operating systems, or web server configurations. They only want to focus on writing and deploying their application. Which cloud service model should they choose?",multiple-choice,Infrastructure as a Service (IaaS),Infrastructure as a Service requires you to manage: · OS updates · web/server software · security patches · VM configuration. Not suitable when the goal is not managing infrastructure.,Platform as a Service (PaaS),"PaaS provides a fully managed application platform where Azure handles: · operating system · runtime environment · web server · security patches · infrastructure scaling. Developers only deploy code, making it ideal for custom web applications without managing servers.",Software as a Service (SaaS),"Software as a Service provides fully developed applications (e.g., Microsoft 365), not a platform for deploying your own custom application.",Functions as a Service (FaaS),"Functions as a Service (e.g., Azure Functions) is for event-driven, serverless functions. It works for small, discrete code executions—not full custom web applications.",,,,,2,"Choose PaaS when you want to deploy custom applications without managing servers, OS, or infrastructure.",Cloud Concepts
A company is exploring Azure AI Services to add intelligent features to their applications. They want to know which type of capability is supported by Azure’s built-in AI services today. Which of the following is a capability that Azure AI Services can provide?,multiple-choice,Detect objects and faces in an image,"Azure AI Services (formerly Cognitive Services) include Vision, Speech, Language, and Decision APIs. The Vision services can: · detect objects · recognize faces · classify images · extract text from images (OCR). So object and face detection is a fully supported capability.",Automatically redesign a website layout,Azure AI Services do not create UI layouts or redesign websites. This is outside the scope of cognitive capabilities.,Convert a mobile app into source code,No Azure AI service reverse-engineers or auto-generates entire application code from an app.,Perform real-time network traffic routing,This is a networking function handled by Azure Traffic Manager or Front Door—not by AI Services.,,,,,1,"Azure AI Services provide capabilities such as computer vision, speech processing, language understanding, and translation—not redesigning applications or performing network operations.",Azure Architecture and Services
Which statement correctly describes the difference between the public cloud and the private cloud deployment models?,multiple-choice,"A public cloud is delivered over the internet and shared among multiple customers, while a private cloud is dedicated to a single organization.","Public Cloud: Owned and operated by cloud providers (e.g., Microsoft, AWS). Available to the general public or large groups. Resources are shared among multiple customers (multi-tenant). Private Cloud: Dedicated to a single organization. Can be on-premises or hosted by a third party. Not shared with other customers.",Both public and private clouds are shared environments used by multiple organizations.,A private cloud is not shared. It is dedicated to a single organization—this is the core property that differentiates it.,"A private cloud is owned by a cloud provider and offered to anyone, while a public cloud is owned by a single organization for exclusive use.","This describes a public cloud, not a private cloud. The second part (""public cloud is owned by a single organization for exclusive use"") is also false.",,,,,,,1,Public cloud = shared infrastructure managed by a provider. Private cloud = dedicated infrastructure for one organization only.,Cloud Concepts
"You are architecting a mission-critical application in Azure that must meet strict uptime requirements. Before finalizing the architecture, you need to understand Azure’s Service Level Agreements (SLAs). Which statement correctly describes Azure SLAs and should influence your design?",multiple-choice,"SLA values differ by service, and higher availability often requires deploying multiple instances or using redundancy features.","Azure SLAs: · vary by service (VMs, storage, databases all have different SLAs) · often depend on architecture choices (e.g., multiple VMs across Availability Zones result in a higher SLA) · require the customer to design for redundancy to meet high availability targets.",All Azure services include the same SLA of 99.99% availability by default.,SLA values differ widely. Examples: Single-instance VM: lower SLA; Load-balanced VMs in zones: higher SLA; Some services may not have an SLA at all unless configured correctly.,You do not need to design for redundancy because Azure automatically provides maximum availability.,Azure does not automatically guarantee maximum uptime. High availability requires architectural decisions such as: · zone redundancy · multi-region deployment · multiple instances.,Azure guarantees 100% uptime for services deployed in multiple regions.,Azure never guarantees 100% uptime. Even geo-redundant services have downtime possibilities.,,,,,1,"Azure SLAs differ by service and architecture. To achieve higher availability, you must design your solution using redundancy and multiple instances—Azure does not do this automatically.",Cloud Concepts
"Your organization has several Azure subscriptions across multiple departments. Leadership wants a way to apply policies, enforce compliance, and manage access across all subscriptions from a central hierarchy. Which Azure feature should they use?",multiple-choice,Resource Groups,Resource groups organize resources within a single subscription. They cannot contain subscriptions or enforce governance across them.,Management Groups,Management Groups allow you to: · organize multiple subscriptions into a logical hierarchy · apply policies and RBAC at higher levels · enforce governance across all child subscriptions · support large-scale enterprise environments. They sit above subscriptions and provide centralized governance.,Azure Blueprints,"Blueprints help deploy standardized environments, but they do not organize subscriptions into a hierarchy. They often work with Management Groups but do not replace them.",Microsoft Entra ID Roles,"Entra ID roles control identity and directory-level permissions, not subscription hierarchy or cross-subscription governance.",,,,,2,"Use Management Groups to structure and govern multiple Azure subscriptions under a single hierarchy, enabling centralized policy enforcement and access control.",Azure Management and Governance
A development team wants to run workflows and small pieces of code without provisioning or managing servers. They want Azure to automatically handle scaling and billing based only on execution. Which Azure compute model meets this requirement?,multiple-choice,Virtual Machine Scale Sets,This still requires VM management and OS maintenance. It is not serverless.,Serverless compute model,"The serverless compute model allows developers to run code or workflows without managing servers, patching, or capacity planning. Azure automatically handles scaling, high availability, and execution-based billing. Azure Logic Apps and Azure Functions are both serverless services.",Container Instances model,Azure Container Instances simplify running containers but do not eliminate underlying compute management to the same degree as serverless. They still require specifying container resources.,PaaS web app model,"Azure App Service is PaaS, not fully serverless. Users still configure plans, scaling tiers, and pricing plans.",,,,,2,Serverless compute lets you run code or workflows without managing servers—Azure handles scaling and billing automatically based on usage.,Cloud Concepts
"You need to secure a subnet inside an Azure Virtual Network by allowing only specific inbound and outbound traffic. You want a simple, built-in Azure feature that filters traffic at the subnet or NIC level. Which Azure feature should you use?",multiple-choice,Azure Firewall,"Azure Firewall is a stateful, fully managed firewall that provides advanced threat protection. It operates at the network edge, not as a basic per-subnet rule set.",Network Security Group,A Network Security Group (NSG) provides: · basic Layer-3/Layer-4 filtering · inbound/outbound security rules · the ability to apply at subnet or NIC level · a lightweight method to protect workloads inside a Virtual Network. It is the correct per-subnet traffic control mechanism.,Azure Front Door,"Front Door is for global HTTP(S) load balancing and web application acceleration, not for subnet-level traffic filtering.",Traffic Manager,"Traffic Manager handles DNS-based traffic routing across regions, not packet filtering or subnet protection.",,,,,2,Use a Network Security Group (NSG) to control subnet-level inbound and outbound traffic in Azure Virtual Networks.,Azure Architecture and Services
Your team is storing backup data that is accessed infrequently but must remain available immediately when needed. They want to reduce storage costs compared to the hot tier. Which statement correctly describes the Azure Blob Storage cool access tier?,multiple-choice,It has lower storage costs than the hot tier but higher access (read) costs.,"The cool access tier is optimized for data that is stored long-term but accessed infrequently. It features: · cheaper storage than the hot tier · higher access and transaction costs · immediate availability (no delays like archive tier). This makes it ideal for backups, disaster recovery data, and infrequently used datasets.",It offers the fastest data access and the lowest read costs of all tiers.,"That describes the hot tier, not the cool tier. Cool tier has higher access costs.",It introduces retrieval delays of several hours before data becomes available.,"This describes the archive tier, which requires rehydration. Cool tier provides instant access.",It is the most expensive tier for both storage and data access.,Storage in the cool tier is cheaper than the hot tier. Archive tier is the one with the most restrictive access model and cheapest storage.,,,,,1,The cool tier offers lower storage cost but higher access cost and keeps data immediately available—ideal for infrequently accessed but important data.,Azure Architecture and Services
"Your organization uses an online business application that is fully managed by the provider. Users access it through a web browser, and all updates, infrastructure, and maintenance are handled automatically by the vendor. Which cloud service model does this application represent?",multiple-choice,Software as a Service (SaaS),SaaS delivers complete applications over the internet. Users simply log in and consume the app; the provider manages: · servers · storage · networking · application updates · security patches. Microsoft Outlook in Microsoft 365 is a classic example of SaaS.,Platform as a Service (PaaS),PaaS provides a platform for developers to build and deploy custom apps. It does not deliver a fully functional business application to end users.,Infrastructure as a Service (IaaS),"IaaS provides virtual machines, networking, and storage. You manage the OS and applications yourself, which is not the case for Microsoft Outlook.",,,,,,,1,"Out-of-the-box applications like Microsoft Outlook (via Microsoft 365) are SaaS, because the provider fully manages the app and infrastructure.",Cloud Concepts
A new user wants to explore Azure services without committing to paid resources. They want to know how much initial monetary credit Microsoft provides when creating a new Azure free account. What is the amount of credit offered?,multiple-choice,Azure provides US$200 in free credit for the first 30 days.,"When you create a new Azure free account, Microsoft gives you: · US$200 credit valid for 30 days · access to 12 months of free services · access to a set of always free services. The $200 credit is the initial monetary benefit.","Azure provides US$500 in free credit, usable for 12 months.",Azure has never offered a $500 starting credit as part of the standard free tier.,Azure provides US$50 per month for one year.,Azure does not provide recurring monthly credits under the free account. Only the initial $200 is provided.,"Azure provides no monetary credit, only permanently free services.",Azure does give free credit—$200 for 30 days.,,,,,1,"A new Azure Free Account includes $200 in credit for the first 30 days, plus access to additional free-tier services.",Azure Management and Governance
