Question,Question Type,Answer Option 1,Explanation 1,Answer Option 2,Explanation 2,Answer Option 3,Explanation 3,Answer Option 4,Explanation 4,Answer Option 5,Explanation 5,Answer Option 6,Explanation 6,Correct Answers,Overall Explanation,Domain
Your organization wants to enhance security by requiring users to verify their identity with a second step during sign-in—such as entering a code from a mobile app or responding to a push notification. Which Microsoft Entra ID feature enables this capability?,multiple-choice,Conditional Access,"Conditional Access can require MFA based on policies, but it is not the feature that provides the additional verification factor itself. MFA is the mechanism; Conditional Access is the policy engine.",Multi-Factor Authentication (MFA),Multi-Factor Authentication (MFA) adds a second verification step to the sign-in process. It commonly uses: · Microsoft Authenticator app notifications · SMS verification codes · Voice calls · Hardware tokens. This drastically reduces account compromise risks by requiring something you know (password) + something you have (phone/app).,Privileged Identity Management (PIM),"PIM manages just-in-time privileged access, not user sign-in verification. It may use MFA, but it does not provide MFA.",Identity Protection,"Identity Protection detects risky sign-ins and users. It does not directly provide MFA, though it may enforce MFA requirements through risk policies.",,,,,2,Multi-Factor Authentication (MFA) is the Microsoft Entra ID feature that adds a second verification step—often using a mobile device—to secure user sign-ins.,Azure Architecture and Services
A business wants to move its applications to Azure so they no longer have to worry about outages caused by on-premises server hardware failures. Azure’s built-in redundancy and ability to keep services running even when components fail is the primary reason for the migration. Which cloud computing benefit does this describe?,multiple-choice,Global scalability,"Scalability is about adjusting capacity based on demand, not protection from hardware failures.",High availability and resiliency,"High availability and resiliency refer to a cloud provider’s ability to: · ensure workloads continue running despite hardware failures · offer redundancy across datacenters, zones, and regions · minimize downtime through fault-tolerant infrastructure. Azure provides built-in redundancy that significantly reduces the risk of downtime due to physical hardware issues.",Elastic cost management,Elasticity allows resources to scale up/down to match usage. It does not address downtime or fault tolerance.,Automated patching,"Patching helps maintain security and performance, but it does not directly reduce the risk of downtime caused by hardware failures.",,,,,2,"Migrating to Azure reduces downtime risk by leveraging the cloud’s high availability and resiliency, which protect workloads from hardware failures.",Cloud Concepts
"An organization wants to centrally manage user identities, authentication, and access to Azure resources, Microsoft 365, and thousands of SaaS apps. They need Azure’s main identity platform. Which Azure service should they use?",multiple-choice,Microsoft Account (MSA),"MSA is for personal accounts (e.g., Outlook.com), not enterprise identity or Azure resource access.",Microsoft Entra ID,"Microsoft Entra ID (formerly Azure Active Directory) is Azure’s: · primary identity store · authentication and authorization service · single sign-on provider · identity governance and security platform. It manages user accounts, groups, roles, access policies, and authentication for Azure and Microsoft cloud services.",Azure Key Vault,"Key Vault stores secrets, certificates, keys. It is not an identity or authentication provider.",Network Security Group,NSGs filter network traffic at the subnet/NIC level. They have no role in identity or authentication.,,,,,2,"Microsoft Entra ID is Azure’s core identity and authentication platform, enabling secure access to cloud resources.",Azure Architecture and Services
You are designing a mission-critical application that must remain online even if an entire Azure datacenter fails. Azure offers a feature that provides physically separate datacenters within a single region to protect against such failures. What is the primary purpose of Azure Availability Zones?,multiple-choice,To provide physically isolated datacenters within a region for higher fault tolerance,"Availability Zones are: · physically separate datacenters within a single Azure region · each zone has independent power, cooling, and networking · designed to protect applications from datacenter-level failures. By placing VMs or services across multiple zones, you achieve high resilience and improved uptime.",To organize Azure resources like virtual machines and databases into logical folders,"Azure has no folder concept. Resource Groups are for organization, not Availability Zones.",To group multiple Azure regions together for global load balancing,"This describes geographies or paired regions, not Availability Zones. Zones exist within a region, not across regions.",To let customers choose the exact server hardware used for their virtual machines,"Azure does not allow manual server-level selection. Availability Zones focus on fault isolation, not hardware selection.",,,,,1,"Azure Availability Zones provide fault isolation by using multiple, physically separate datacenters within the same region, enabling high availability for critical workloads.",Azure Architecture and Services
"In Azure, you frequently deploy services that run applications, execute logic, or process data. These services rely on CPU power to perform computations. Which statement best defines Azure compute resources?",multiple-choice,They include services that run applications or workloads requiring processing power.,"Azure compute resources are services that perform processing tasks, requiring CPU, memory, or execution environments. These include: · Virtual Machines · App Services · Container Instances · Azure Kubernetes Service · Serverless compute (Functions, Logic Apps). They encompass any service that performs computation, not just VMs.",They refer only to Virtual Machines and exclude all other services.,"Compute services include much more than VMs (serverless compute, AKS, containers, etc.). VMs are just one type.","They represent any Azure resource that stores data, such as Blob Storage.","Storage resources (Blob Storage, Disk Storage, SQL DB storage) are not compute resources, because they store data rather than process it.",They include only serverless resources like Azure Functions.,"Serverless compute (e.g., Azure Functions) is part of compute, but compute is much broader, including IaaS and PaaS compute services.",,,,,1,"Azure compute resources are any services that execute workloads and require CPU/memory, ranging from VMs to serverless functions.",Azure Architecture and Services
"Your team needs to let a colleague manage certain Azure resources in your subscription. You want to give them access without sharing your username or password, using Azure’s built-in identity and access controls. Is this possible?",multiple-choice,YES,"Azure allows you to grant access to your subscription using Role-Based Access Control (RBAC) in Microsoft Entra ID. This means: · You assign a role (e.g., Reader, Contributor, Owner) to another user. · They sign in with their own username/password. · You never share your credentials. This is the recommended and secure method for granting access in Azure.",NO,You should never share your username and password. Azure provides RBAC specifically to avoid credential sharing.,,,,,,,,,1,You can securely grant access to your Azure subscription using RBAC roles in Microsoft Entra ID—no credential sharing required.,Azure Architecture and Services
Which statement correctly describes a Distributed Denial of Service (DDoS) attack?,multiple-choice,"An attack that floods a service with massive amounts of traffic from multiple sources, causing it to become unavailable to legitimate users","A DDoS attack overwhelms a target (website, service, or network) by sending extremely high volumes of traffic from many distributed sources (often compromised devices). This prevents legitimate users from accessing the service, resulting in downtime.",An attack where a hacker injects malicious JavaScript into a website to steal user credentials,"This describes Cross-Site Scripting (XSS), not DDoS.",An attack that secretly encrypts an organization’s data and demands payment to restore access,"This is ransomware, not denial of service.",An attack that tricks users into revealing sensitive information through fraudulent emails,"This is phishing, not a DDoS attack.",,,,,1,"A DDoS attack overwhelms a service with massive traffic from many distributed sources, making it unavailable to legitimate users.",Azure Management and Governance
"A global company wants its users around the world to load images, videos, and static website content quickly. They also want to reduce the load on their origin web server by caching these files closer to end-users. What is the primary benefit of using a Content Delivery Network (CDN)?",multiple-choice,It caches static content at edge locations to reduce latency and server load.,"A Content Delivery Network (CDN) distributes static content—such as images, videos, CSS/JS files—across a global network of edge servers. This provides: · lower latency (content served from a node close to the user) · reduced load on the origin server · faster website performance globally.",It stores user session information such as shopping cart details.,"Session storage is handled by application frameworks, databases, or cache services (e.g., Redis), not a CDN.",It automatically scales virtual machines that host the website.,"This is done by Virtual Machine Scale Sets, App Service scaling, or AKS, not a CDN.",It acts as a database to store large amounts of application data.,"A CDN is not a storage system for application data. It caches copies of static assets, not primary data storage.",,,,,1,A CDN’s main benefit is caching static content at global edge locations to improve performance and reduce load on the origin server.,Azure Architecture and Services
"You are designing a cloud-based application that must remain operational even during unexpected failures. To ensure the system can continue running when components malfunction, you must apply a key high-availability design principle. Which principle should guide your architecture?",multiple-choice,Design the system so that no single component failure can bring down the entire application,"High availability requires resilience, meaning the system should continue operating even if individual components fail. This is achieved by: · distributing resources across availability zones or regions · using multiple instances of critical services · eliminating single points of failure.",Use the largest possible virtual machine size to minimize the risk of failure,"Bigger VMs do not increase availability. High availability is about redundancy, not raw capacity.",Ensure all application components run in the same datacenter to simplify management,"This increases the risk of downtime, because a datacenter failure would take down the whole system.",Avoid using redundancy because it increases operational complexity,"Redundancy is essential for fault tolerance. Without it, a single failure can lead to system-wide outages.",,,,,1,"High availability is achieved by designing for resilience and eliminating single points of failure, not by relying on a single server or datacenter.",Azure Architecture and Services
"Your organization plans to set up a secure Site-to-Site VPN between its on-premises datacenter and Azure. To complete the connection, Azure requires that your on-premises network has a device capable of establishing and maintaining the VPN tunnel. What type of device must be in place on-premises?",multiple-choice,A DNS server,"DNS is unrelated to VPN tunneling. It resolves names, not secure network connections.",A compatible VPN gateway device,A Site-to-Site VPN requires two endpoints: · Azure VPN Gateway in the cloud · A compatible VPN device on the on-premises network. This on-prem device can be a hardware VPN appliance or a VPN-capable firewall that supports industry-standard IPsec.,A load balancer,A load balancer distributes traffic but cannot terminate or establish a VPN tunnel.,A traffic routing appliance provided by Azure,Azure does not provide hardware appliances for your on-premises environment. Only the Azure-side gateway is cloud-hosted.,,,,,2,A Site-to-Site VPN requires a VPN-capable device on-premises to establish the IPsec tunnel with Azure’s VPN Gateway.,Azure Architecture and Services
You come across a new Azure capability marked as private preview. You're considering testing it but need to understand what this preview status implies. Which statement correctly describes Azure services in private preview?,multiple-choice,They are available only to a limited set of customers who have been approved by Microsoft.,"Private preview features are early-stage Azure services available only to selected customers. Access typically requires: · registration · Microsoft approval · a direct invitation. These services are not supported, not covered by SLAs, and are not recommended for production use.",They are fully supported services with complete SLA guarantees.,Private preview services do NOT have SLAs or official Microsoft support. Only GA (Generally Available) services do.,They are open to all Azure customers and can be used freely in production.,"That describes public preview, not private preview. Even in public preview, production use is discouraged.",They represent features that have been retired and will soon be removed from Azure.,"Private preview refers to new, experimental features—not retired ones.",,,,,1,Azure private preview services are available only to selected customers and do not include SLAs or production support. They exist for early testing and feedback.,Azure Management and Governance
"An organization plans to migrate its datacenter workloads to Azure. Instead of buying expensive servers upfront, they prefer to pay only for the cloud resources they consume each month. Which cloud computing benefit does this scenario represent?",multiple-choice,Elastic scaling,Elasticity refers to automatically scaling resources up/down based on demand. It is unrelated to avoiding upfront hardware purchases.,Capital expenditure to operational expenditure shift,"By moving to the cloud, companies avoid large upfront purchases of physical hardware (CapEx). Instead, they pay only for the resources they use, converting costs into operational expenses (OpEx).",Global resiliency,This refers to the ability of cloud providers to keep services running across multiple regions. It does not address cost structure.,Automated fault recovery,"Fault tolerance deals with maintaining service availability during failures, not financial benefits.",,,,,2,"Migrating to Azure helps organizations shift from CapEx to OpEx, paying only for the cloud resources they consume—no large upfront hardware costs.",Cloud Concepts
"Your organization wants to forecast the cost of running various Azure services before deploying them. They need a web-based tool that allows them to add services, configure options, and calculate estimated monthly pricing. Which Azure tool should they use?",multiple-choice,Azure Pricing Calculator,The Azure Pricing Calculator is a web-based tool that allows you to: · add Azure services to a cost estimate · adjust configuration options · model expected usage · calculate projected monthly or annual cost.,Azure Monitor,Azure Monitor collects metrics and logs from running resources but does not estimate or calculate pricing.,Azure Service Health,"Service Health provides information about outages and maintenance events, not pricing estimates.",,,,,,,1,Use the Azure Pricing Calculator to estimate future Azure costs by adding and configuring services in a shopping-cart style interface.,Azure Management and Governance
Your organization stores sensitive files in Azure Blob Storage and wants them to be automatically encrypted at rest without requiring any manual configuration. Azure should also decrypt the data transparently when it is accessed by authorized users. Which Azure feature provides this capability by default?,multiple-choice,Azure Storage Service Encryption (SSE),Azure Storage Service Encryption (SSE) automatically: · encrypts data before writing it to Azure Blob Storage · decrypts data when accessed by authorized users · uses Microsoft-managed keys by default · requires no application changes.,Azure Disk Encryption,This encrypts virtual machine OS and data disks using BitLocker or DM-Crypt. It does not apply to Blob Storage.,Azure Information Protection,AIP applies labels and rights management to documents and emails. It is not used for at-rest encryption of storage accounts.,Azure Key Vault,"Key Vault stores encryption keys, secrets, and certificates. It does not perform the encryption of Blob Storage by itself—SSE does that.",,,,,1,"SSE automatically encrypts and decrypts Azure Blob Storage data, providing transparent encryption at rest with no user configuration required.",Azure Management and Governance
"A development team is planning to run a workflow that only executes a few times per day. They want to minimize costs by paying only when the workflow actually runs, rather than paying for compute resources that sit idle. What is the primary benefit of using a consumption-based (pay-per-use) pricing model?",multiple-choice,"You pay only for actual resource usage, which can greatly reduce costs for workloads that do not run continuously",A consumption-based pricing model bills you only when compute resources actually execute. This can significantly reduce costs for: · event-driven workloads · batch jobs · infrequent or sporadic processes · serverless functions.,It guarantees lower costs than any other pricing model,"Consumption isn’t always cheaper. If workloads run continuously, hourly or reserved pricing may be more economical.",It provides the simplest and most predictable monthly billing,"Consumption billing can be less predictable, because it depends on usage spikes and changes.",It ensures unlimited performance without additional charges,"Performance costs still scale with usage—the more your workload runs, the more you pay.",,,,,1,"Consumption-based pricing saves money when workloads do not run continuously, because you pay only for actual execution, not idle time.",Azure Management and Governance
You need to design a critical workload in Azure that must meet the highest possible SLA for virtual machines. Azure recommends distributing VMs so that a failure in one physical datacenter does not affect the entire application. Which deployment approach provides the highest availability?,multiple-choice,Deploy multiple virtual machines across different Availability Zones in the same region,"Deploying VMs across Availability Zones provides the highest level of resiliency because: · Each zone is a physically separate datacenter · Zones have independent power, cooling, and networking · A zonal failure does not impact VMs in other zones · Azure offers its highest VM SLA for zone-redundant deployments.",Deploy a single virtual machine with premium SSDs,A single VM has the lowest SLA and creates a single point of failure.,Deploy multiple virtual machines inside a single Availability Set,"Availability Sets protect against rack-level failures, not entire datacenter failures. They offer a good SLA, but still lower than zone redundancy.",Deploy all virtual machines inside the same datacenter rack for performance,This dramatically reduces availability because a rack failure would take down all VMs.,,,,,1,"For the highest SLA and maximum availability, deploy VMs across multiple Availability Zones within the same Azure region.",Azure Architecture and Services
Your team is planning to deploy a large number of identical virtual machines using an Azure Virtual Machine Scale Set (VMSS). They want to understand the default maximum number of VMs that can be placed in a single VMSS without requesting a quota increase. What is the default maximum number of VMs allowed in a single VM Scale Set?,multiple-choice,500,This is below the actual default limit. Azure allows double this amount under normal conditions.,"1,000","By default, an Azure Virtual Machine Scale Set (VMSS) can contain up to 1,000 VMs when using uniform orchestration mode. This limit applies before any special quota increase requests are submitted.","10,000","Azure does not support 10,000 VMs in a single VMSS by default. This significantly exceeds standard limits.",Unlimited,No Azure service allows unlimited scaling. All compute services have defined limits and quotas.,,,,,2,"An Azure VM Scale Set can include up to 1,000 virtual machines by default, enabling large-scale deployments without manual VM management.",Azure Architecture and Services
A company keeps most of its applications and data on-premises but wants to extend its datacenter by adding Azure resources for additional compute and storage capacity. Both environments need to work together seamlessly. Which cloud deployment model does this represent?,multiple-choice,Public cloud,"A public cloud model would mean hosting all workloads in the cloud provider’s infrastructure, not extending an on-premises setup.",Hybrid cloud,A hybrid cloud combines: · on-premises infrastructure · public cloud resources (such as Azure). This model allows organizations to: · extend datacenter capabilities · use cloud services while keeping critical workloads on-prem · gradually migrate or burst into the cloud as needed.,Private cloud,"A private cloud is dedicated to a single organization, either on-prem or hosted, and does not involve public cloud integration.",,,,,,,2,"A hybrid cloud deployment extends on-premises infrastructure into Azure, enabling seamless integration between both environments.",Cloud Concepts
"Your organization needs a Microsoft tool that can evaluate compliance posture, provide recommendations, and help track alignment with standards such as GDPR, ISO/IEC 27001, and NIST. The tool should also offer a compliance score and improvement actions. Which Microsoft tool provides these capabilities?",multiple-choice,Microsoft Purview Compliance Manager,Microsoft Purview Compliance Manager helps organizations: · assess compliance with global regulations and industry standards · receive actionable improvement recommendations · track progress using a compliance score · manage regulatory risk.,Azure Policy,"Azure Policy enforces organizational rules within Azure, but it does not assess compliance against external standards like GDPR or ISO.",Microsoft Defender for Cloud,"Defender for Cloud focuses on security posture, threat protection, and security recommendations—not regulatory compliance scoring.",Azure Advisor,"Azure Advisor provides cost, performance, reliability, and security optimization recommendations, not regulatory compliance assessments.",,,,,1,"Microsoft Purview Compliance Manager is the tool that helps organizations assess, score, and improve compliance with international and industry standards.",Azure Architecture and Services
"Your operations team wants a single Azure service that can collect logs and metrics from virtual machines, applications, databases, and other Azure resources. They also need to run queries, build charts, and set up alerts based on this data. Which Azure service should they use?",multiple-choice,Azure Monitor,"Azure Monitor is Azure’s unified monitoring and observability platform. It can: · collect metrics, logs, and traces from many Azure resources · store log data in Log Analytics workspaces · run Kusto Query Language (KQL) queries · build dashboards and visualizations · create alerts based on conditions.",Azure Activity Log,Tracks control-plane actions (like resource creation or modification) but does not collect full telemetry or support complex log queries.,Azure Storage Explorer,"A tool for managing storage accounts, not for monitoring, querying, or alerting on logs.",Azure Advisor,"Provides recommendations (cost, security, reliability) but does not store logs or allow telemetry queries.",,,,,1,"Azure Monitor centralizes Azure telemetry, enables log queries, visualizations, and alerting—making it the core observability platform in Azure.",Azure Architecture and Services
