Question,Question Type,Answer Option 1,Explanation 1,Answer Option 2,Explanation 2,Answer Option 3,Explanation 3,Answer Option 4,Explanation 4,Answer Option 5,Explanation 5,Answer Option 6,Explanation 6,Correct Answers,Overall Explanation,Domain
"A government agency must host highly sensitive workloads that cannot be placed on shared infrastructure. They require maximum control over security, compliance, and data governance. Which cloud deployment model best satisfies these requirements?",multiple-choice,Public Cloud,"Runs on shared infrastructure; not ideal for workloads requiring strict isolation. Compliance can be achieved, but the highest control is not available.",Private Cloud,"Ideal for sensitive data, dedicated infrastructure, and custom security controls. Commonly used by government agencies for maximum control.",Multi-Cloud,Refers to using services from multiple cloud providers; not a deployment model that guarantees data isolation by itself.,Hybrid Cloud,"Mixes on-premises and public cloud. Useful for flexibility, but may still involve shared infrastructure for some workloads.",,,,,2,"A private cloud provides dedicated infrastructure, offering the highest level of control, security, and compliance for sensitive workloads.",Cloud Concepts
"Under the cloud shared responsibility model, the cloud provider secures the physical datacenters, networking, and the underlying infrastructure. Who is responsible for protecting and securing the data that is stored inside cloud services?",multiple-choice,"The cloud provider, because they own and operate the datacenters","Incorrect — while they secure the platform, they do not manage your data or who can access it.","The customer, because they control the data and how it is used","In the shared responsibility model, customers are always responsible for data security, classification, encryption choices, and identity access.",No one — data security is automatically handled by the cloud,"Incorrect — cloud platforms provide tools, but customers must configure and secure their own data.","Both the customer and the cloud provider equally, regardless of service model","Incorrect — responsibility shifts depending on IaaS, PaaS, or SaaS, but data ownership always remains with the customer.",,,,,2,"In cloud computing, you are always responsible for securing and protecting your own data, regardless of the service model.",Azure Management and Governance
"When deploying virtual machines inside an Azure Availability Set, Azure automatically spreads them across multiple fault domains. What does a fault domain represent in Azure?",multiple-choice,A group of VMs that share the same operating system,"No – fault domains are about hardware, not software.",A set of hardware resources that share a common power source and network switch,A fault domain represents a physical rack of servers with a distinct power source and network switch to reduce the impact of hardware failures.,A region where disaster recovery backups are stored,"Incorrect — that relates to paired regions, not fault domains.",A logical grouping of subnets inside a virtual network,"Incorrect — that describes virtual network structure, not physical datacenter layout.",,,,,2,"A fault domain is a physical separation inside a datacenter that protects resources from rack, power, or network failures.",Azure Architecture and Services
"An Azure application is experiencing increased traffic. Instead of moving to a larger virtual machine size, the engineering team decides to add more identical VM instances behind a load balancer to handle the increased load. What type of scaling does this scenario represent?",multiple-choice,Vertical scaling,Means upgrading to a more powerful machine (adding CPU/RAM) rather than adding more instances.,Horizontal scaling,"Horizontal scaling means adding more instances of a resource (expanding out), commonly used in auto-scaling and load-balanced scenarios.",Diagonal scaling,"A hybrid concept combining vertical and horizontal scaling, but not what is happening in this specific scenario.",Performance tuning,"Related to optimizing software or configuration, not adding hardware capacity.",,,,,2,"Horizontal scaling increases capacity by adding more instances, while vertical scaling increases capacity by upgrading a single instance.",Cloud Concepts
A company relies on an online ordering system that must stay operational at all times. Even short periods of downtime could result in lost sales and damaged customer trust. How does high availability (HA) help protect the business from financial loss?,multiple-choice,By guaranteeing that no data will ever be lost,"This is data redundancy / backup. HA focuses on uptime and accessibility, not data preservation.",By keeping services running during failures so the business can continue generating revenue,"HA ensures applications remain accessible during hardware or datacenter failures, preventing lost sales and maintaining customer trust.",By eliminating the need for backups,"Incorrect — backups are still required to protect against accidental deletion, corruption, or ransomware.",By intentionally increasing downtime to perform system maintenance,The opposite of HA. HA reduces or eliminates downtime.,,,,,2,"High availability minimizes downtime, allowing businesses to continue generating revenue and avoid financial losses during failures.",Cloud Concepts
An organization wants to minimize storage costs and does not require cross-region replication. They only need multiple copies of their data stored within a single Azure datacenter. Which Azure Storage redundancy option provides the lowest cost?,multiple-choice,Zone-Redundant Storage (ZRS),Replicates data across multiple Availability Zones; more expensive than LRS.,Locally Redundant Storage (LRS),"LRS keeps three copies within a single datacenter. Since it doesn't replicate across zones or regions, it is the lowest-cost option.",Geo-Redundant Storage (GRS),Replicates data to a secondary region hundreds of miles away; much more expensive than LRS.,Geo-Zone-Redundant Storage (GZRS),"Combines ZRS and GRS for highest resilience, but is the most expensive redundancy tier.",,,,,2,Locally Redundant Storage (LRS) is the cheapest Azure redundancy option because it keeps multiple copies only within a single datacenter.,Azure Architecture and Services
Your organization manages several Azure subscriptions and wants to enforce governance rules—such as policy assignments and role-based access—across all of them from a single point of control. Which statement correctly describes Azure Management Groups?,multiple-choice,They allow you to organize subscriptions hierarchically and apply governance controls across all subscriptions within the same tenant.,"Management Groups provide a hierarchy to apply Azure Policy and RBAC at scale, ensuring governance is inherited down the tree.",They automatically combine resources from multiple subscriptions into a single billing account.,"Incorrect — billing is handled at the subscription or billing account level, not by management groups.",They are limited to one level and cannot contain other management groups.,Incorrect — management groups support up to six levels of hierarchy.,They allow subscriptions to belong to multiple management groups at the same time.,Incorrect — a subscription can belong to exactly one management group at a time.,,,,,1,Azure Management Groups enable centralized governance by applying policies and access controls across multiple subscriptions using a hierarchical structure.,Azure Management and Governance
A company operates its primary workloads in its on-premises datacenter but extends capacity into Azure only during seasonal spikes. This allows them to add temporary compute resources in the cloud while keeping most systems on-prem. What cloud deployment model does this represent?,multiple-choice,Public Cloud,Applies only when all workloads run entirely in the cloud. Primary workloads remain on-prem here.,Multi-Cloud,"Means using multiple cloud providers (e.g., Azure + AWS). This scenario uses Azure + on-prem.",Hybrid Cloud,"A Hybrid Cloud combines on-premises infrastructure with public cloud resources, commonly used for ""cloud bursting"" during peak demand.",Private Cloud,"Refers to infrastructure dedicated to one organization. This scenario uses Azure, which is a public cloud.",,,,,3,Using on-prem infrastructure while extending capacity to Azure during peak demand is known as a Hybrid Cloud deployment.,Cloud Concepts
"Your organization wants to lift-and-shift legacy applications into Azure. These applications require domain join, LDAP, NTLM, or Kerberos authentication, but the company does not want to deploy or maintain domain controllers in the cloud. Which Azure feature should they use?",multiple-choice,Microsoft Entra ID (Azure AD),"Azure AD provides cloud identity but does NOT provide classic domain join, Kerberos, or NTLM services.",Microsoft Entra Domain Services,Provides a managed domain with support for legacy protocols (NTLM/Kerberos) and domain join without managing domain controllers.,Azure Virtual Network Peering,Used for connecting virtual networks; unrelated to identity or domain authentication.,Azure DNS,Provides DNS hosting; does not offer identity or authentication services.,,,,,2,Microsoft Entra Domain Services provides classic Windows Active Directory capabilities in the cloud without requiring domain controllers.,Azure Architecture and Services
"An enterprise wants to ensure that all Azure resources follow internal standards such as required tags, approved regions, and cost controls. The IT team performs routine reviews of deployed resources to verify compliance. Which cloud concept does this activity represent?",multiple-choice,Reliability,"Focuses on system uptime and resiliency, not compliance or auditing practices.",Governance,"Governance involves defining policies, ensuring compliance, and monitoring resource usage to meet corporate standards.",Elasticity,Refers to automatically scaling resources based on demand; unrelated to compliance reviews.,Fault Tolerance,Describes systems designed to continue operating when hardware failures occur.,,,,,2,Cloud governance ensures that resources comply with organizational and regulatory requirements through policies and auditing.,Cloud Concepts
A startup wants to avoid paying for idle infrastructure and prefers a billing model where costs increase only when their applications receive more traffic. Which benefit of consumption-based pricing supports this?,multiple-choice,It allows businesses to forecast expenses with fixed monthly pricing,"Incorrect — fixed pricing describes reserved or subscription models, not consumption-based billing.",It aligns IT spending directly with the amount of resources actually used,"Consumption-based (pay-as-you-go) billing ensures you only pay for what you use, making it ideal for variable workloads and startups.",It requires organizations to purchase capacity in advance,"Incorrect — that is the definition of CapEx or reserved capacity, which is the opposite of consumption-based.",It limits how many resources a company can deploy,Incorrect — consumption models allow for virtually unlimited scaling based on demand.,,,,,2,"Consumption-based pricing aligns cloud costs with real usage, preventing overspending and eliminating upfront investment.",Cloud Concepts
Your organization wants to avoid unexpected Azure charges. They need a tool to notify them when spending approaches or exceeds planned thresholds. Which Azure feature should they use?,multiple-choice,Azure Advisor,Advisor provides recommendations for optimization but does not set or track spending budgets.,Azure Budgets,Azure Budgets allows you to set cost thresholds and receive proactive alerts as usage approaches those limits.,Azure Monitor Metrics,"Monitor Metrics tracks technical performance (CPU/RAM), not financial billing thresholds.",Cost Allocation Rules,Used to distribute shared costs among departments; doesn't provide threshold alerting.,,,,,2,Azure Budgets helps organizations proactively manage cloud spending by setting cost thresholds and generating alerts.,Cloud Concepts
A mission-critical application must remain operational even if an entire datacenter within a region experiences a failure. Which Azure feature provides this resiliency?,multiple-choice,Resource Groups,"Resource Groups are for logical organization, not for providing high availability or hardware redundancy.",Virtual Network Peering,Peering connects networks; it does not protect against physical datacenter failures.,Availability Zones,"Availability Zones are physically separate datacenters within a region with independent power and cooling, protecting against datacenter-level outages.",Azure Regions,"A region is a geographic area. While it contains datacenters, simply being in a region doesn't guarantee protection from a single datacenter failure without using zones.",,,,,3,Availability Zones offer high availability by placing resources in physically separate datacenters within a region.,Azure Architecture and Services
"A team wants to package an application with its runtime, libraries, and dependencies so it behaves consistently across dev, test, and production. Which compute option is best?",multiple-choice,Serverless Functions,Functions are event-driven and don't package full application stacks for portability in the same way containers do.,Virtual Machines,"VMs include a full OS, making them heavier and less portable than containers for consistent packaging.",Containers,Containers package code and dependencies into a lightweight unit that runs identically in any environment.,Bare-Metal Servers,Physical servers require manual setup and offer no built-in packaging or portability mechanism.,,,,,3,"Containers allow applications and their dependencies to run consistently everywhere, making them ideal for portable deployments.",Azure Architecture and Services
Which Microsoft Entra feature ensures only compliant devices or specific locations can access applications by requiring additional authentication steps?,multiple-choice,Microsoft Entra Identity Protection,Detects risky behavior but is not the primary engine for setting access rules based on device/location.,Microsoft Entra Conditional Access,Conditional Access is a policy engine that evaluates signals (like location or device) to enforce access requirements like MFA.,Microsoft Entra Domain Services,Provides legacy domain services (LDAP/Kerberos) but is not used for condition-based access rules.,Role-Based Access Control (RBAC),RBAC controls *what* a user can do after they are in; it doesn't set conditions for *how* they sign in.,,,,,2,"Conditional Access enforces adaptive, condition-based policies that determine how and when users can access cloud resources.",Azure Architecture and Services
Which benefit of containers ensures an application behaves the same way in development and production environments?,multiple-choice,Containers automatically improve network latency,"Incorrect — network performance is determined by infrastructure, not the container packaging itself.",Containers guarantee stronger security than all other compute options,"While isolated, they are not inherently more secure than all other options (like dedicated physical hosts).",Containers package applications with their dependencies for consistent behavior across environments,"Consistency and portability are the core benefits of containers, ensuring the environment remains the same from dev to prod.",Containers provide unlimited storage for applications,Incorrect — containers share host resources and storage must be provisioned separately.,,,,,3,"The primary advantage of containers is portability, allowing applications to run the same way everywhere.",Azure Architecture and Services
"An organization needs protection against regional outages and wants Azure to automatically replicate storage data to a secondary geographic region, maintaining 6 total copies. Which option is correct?",multiple-choice,Locally Redundant Storage (LRS),Stores only 3 copies within a single datacenter; no protection against regional outages.,Zone-Redundant Storage (ZRS),Stores 3 copies across zones within a single region; no cross-region replication.,Geo-Redundant Storage (GRS),GRS maintains 3 copies in the primary region and 3 copies in a secondary paired region (6 total) to protect against regional disasters.,,,,,,,3,"GRS stores six copies of your data across two regions, providing protection against regional-level outages.",Azure Architecture and Services
"Why should a team place related resources (VMs, storage, networks) for a single application into the same Azure Resource Group?",multiple-choice,To automatically reduce Azure billing costs,"Resource groups are for management, not for automated cost reduction.",To increase the performance of deployed resources,Logical grouping in a resource group does not change the physical performance of the hardware.,"To simplify management, deployment, and lifecycle operations","Grouping resources allows you to manage them as a single unit, making it easier to deploy or delete the entire stack at once.",To encrypt all resources by default,"Encryption is managed at the service level (e.g., Storage Service Encryption), not by the resource group.",,,,,3,Resource Groups simplify the management and lifecycle of related Azure resources by treating them as a single logical unit.,Azure Management and Governance
"What is the correct term used in Azure to describe individual, manageable service instances like a virtual machine or storage account?",multiple-choice,Azure subscription,"A subscription is a container for billing and multiple resources, not an individual instance.",Azure resource,"A resource is any manageable item available through Azure, such as a VM, database, or virtual network.",Azure region,"A region is a physical geographic location, not a service instance.",Azure management group,"Management groups are used to govern multiple subscriptions, not individual services.",,,,,2,An Azure resource is any individual service instance—such as a VM—that you create and manage in Azure.,Azure Architecture and Services
"Your team needs full control over the OS, installed software, and patching schedule. Which Azure service most closely resembles a traditional on-premises server?",multiple-choice,Azure Functions,A serverless service where Azure manages everything; the user has no OS access.,Azure App Service,A PaaS offering where Azure manages the OS and runtime; user control is limited to the app code.,Azure Virtual Machines,"Virtual Machines (IaaS) provide full control over the OS, software, and configuration, mimicking on-prem servers.",Azure SQL Database,A fully managed PaaS database; the user does not have access to the underlying server or OS.,,,,,3,"Azure Virtual Machines are the primary IaaS offering, giving customers full control over the operating system and runtime.",Cloud Concepts
"A development team wants to run small pieces of code that execute only when triggered by events, such as an HTTP request or a file upload. They do not want to manage servers or worry about scaling. Which Azure service best supports this serverless computing model?",multiple-choice,Azure Virtual Machines,An IaaS service where you manage the OS and server. Not serverless.,Azure App Service,"A PaaS service for hosting web apps and APIs. Azure manages the OS, but it is not serverless.",Azure Functions,"Azure Functions is a serverless compute service that runs code in response to events, automatically scales, and charges only for execution time.",Azure Storage Account,"Used for data storage (blobs, files, queues, tables). Does not execute code.",,,,,3,"Azure Functions is a serverless service, allowing you to run event-driven code without managing servers.",Azure Architecture and Services
You are designing an application that must remain available even if one Azure datacenter within a region goes offline. You want to use Azure services that natively support deployment across multiple Availability Zones. Which of the following statements is correct?,multiple-choice,Only Azure Virtual Machines can be deployed across Availability Zones,Incorrect — App Service and Storage also support Availability Zones.,Only Azure App Service supports zone-redundant deployments,Incorrect — VMs and Storage can also be zone-redundant.,Only Azure Storage supports Availability Zones,Incorrect — compute services like VMs and App Service also support zones.,Multiple Azure services support Availability Zones and can be used together to build highly available applications,"Azure provides Availability Zone support across multiple services including VMs, App Service, and Storage (ZRS/GZRS) to create resilient applications.",,,,,4,High availability across Availability Zones is achieved by combining multiple Azure services that natively support zone redundancy.,Azure Architecture and Services
"An organization designs its security strategy so that even if one control fails (for example, a firewall rule), other controls such as identity verification, encryption, and monitoring still protect the system. Why is this layered security approach effective?",multiple-choice,It removes the need for regular patching,Incorrect — regular updates and patching are still critical for security.,It ensures attackers must bypass multiple independent security controls,"The defense-in-depth model uses multiple layers (Identity, Network, App, Data) to reduce the likelihood of a successful breach and limit damage.",It allows security to be managed from a single tool only,Incorrect — defense-in-depth intentionally spreads controls across multiple layers and tools.,It prevents all security incidents from ever occurring,"Incorrect — no security model can guarantee zero incidents. Defense-in-depth reduces risk, it does not eliminate it.",,,,,2,"Defense-in-depth improves security by adding multiple, independent layers of protection that make successful attacks much harder.",Azure Management and Governance
"A large enterprise requires a dedicated, private network connection between its on-premises datacenter and Azure. The traffic must not traverse the public Internet and should provide predictable performance and higher reliability. Which Azure connectivity option meets these requirements?",multiple-choice,Point-to-Site VPN,Used to connect individual client devices to Azure over the public Internet. Not private line connectivity.,Site-to-Site VPN,Connects on-premises networks to Azure but uses encrypted tunnels over the public Internet. Not a private line.,Azure ExpressRoute,"Azure ExpressRoute provides a private, dedicated connection to Azure that does not use the public Internet and offers predictable performance.",Azure Load Balancer,Distributes network traffic across backend resources. Not a connectivity solution between on-premises and Azure.,,,,,3,"Azure ExpressRoute is the only Azure connectivity option that provides private, non-Internet-based connectivity between on-premises networks and Azure.",Azure Architecture and Services
_________ provides fully managed cloud file shares in Azure that can be mounted simultaneously by multiple virtual machines using standard file-sharing protocols like SMB and NFS.,multiple-choice,Azure Blob Storage,Used for object storage (unstructured data). Does not support SMB or NFS mounting.,Azure File Storage,"Azure File Storage provides cloud-based file shares that support SMB and NFS, allowing them to be mounted by multiple VMs at the same time.",Azure Queue Storage,Used for message queuing between application components. Not for file sharing.,Azure Disk Storage,Provides disks for individual virtual machines. Cannot be shared across multiple VMs like a file share.,,,,,2,Azure File Storage is the Azure service that provides shared file storage accessible via SMB and NFS from anywhere.,Azure Architecture and Services
"Azure is designed to improve resiliency during large-scale outages, such as natural disasters that affect an entire region. When an entire Azure region becomes unavailable, where do supported Azure services typically fail over to by design?",multiple-choice,A random Azure region chosen at runtime,"Incorrect — failover follows a predefined region-pair strategy, not random selection.",The nearest available region in a different geography,Incorrect — Azure avoids crossing geographies automatically due to compliance and data residency requirements.,"Its paired region within the same geography, located hundreds of miles away","Azure regions are organized into pairs within the same geography, separated by at least 300 miles, to provide disaster recovery.",Only to regions located in the United States,"Incorrect — region pairing exists globally, not only in the United States.",,,,,3,Azure uses region pairs—separated by at least 300 miles within the same geography—to provide reliable regional disaster recovery.,Azure Architecture and Services
