Question,Question Type,Answer Option 1,Explanation 1,Answer Option 2,Explanation 2,Answer Option 3,Explanation 3,Answer Option 4,Explanation 4,Answer Option 5,Explanation 5,Answer Option 6,Explanation 6,Correct Answers,Overall Explanation,Domain
An organization wants to reduce the risk of unauthorized access if a password is compromised. Which statements describe the benefits of Multi-Factor Authentication (MFA)? (Select all that apply),multi-select,MFA requires users to provide more than one form of verification when signing in,"MFA uses a combination of factors: something you know (password), have (phone), or are (biometrics).",MFA significantly reduces the risk of account compromise if passwords are stolen,"Even with a stolen password, an attacker cannot gain access without the second verification factor.",MFA completely removes the need for passwords in all scenarios,MFA adds layers to passwords; 'Passwordless' is a related but separate security implementation.,MFA improves security by combining something you know with something you have or are,Layering different factor types makes unauthorized access significantly more difficult for attackers.,,,,,"1,2,4","MFA enhances security by requiring multiple independent forms of verification, greatly reducing the risk of unauthorized account access.",Azure Management and Governance
Virtual Network peering is configured between two VNets in different regions. Which statements describe how data travels between these peered VNets? (Select all that apply),multi-select,Traffic flows over the Microsoft global backbone network,"Azure uses its own high-speed, low-latency private global fiber network to carry peered traffic between regions.",Traffic stays on Azure’s private network and does not traverse the public internet,"VNet peering communication is private and never touches the public internet, providing high security and performance.",Traffic is routed over the public internet unless ExpressRoute is used,"Peering specifically avoids the public internet by design, regardless of whether ExpressRoute is present.",,,,,,,"1,2","VNet peering routes traffic over the Microsoft global private network backbone, ensuring data never traverses the public internet.",Azure Management and Governance
An organization runs hundreds of identical VMs that must be managed consistently. Which Azure services are designed to centrally manage large numbers of compute instances? (Select all that apply),multi-select,Virtual Machine Scale Sets,"The primary service for managing identical VMs, supporting automatic scaling and rolling updates.",Azure Kubernetes Service (AKS),"Manages clusters of VMs (nodes) that run containers, automating their scaling, health, and updates.",Azure App Service,A PaaS offering that manages applications; it abstracts away the VMs so you don't manage them directly.,Individual Azure Virtual Machines,Managing VMs one-by-one is an IaaS approach that is inefficient and lacks centralized management at scale.,,,,,"1,2","To centrally manage large numbers of compute instances, use Virtual Machine Scale Sets or AKS (for containerized workloads).",Azure Architecture and Services
A company runs non-critical workloads that can tolerate interruptions. Which characteristics make Azure Spot Virtual Machines suitable for this scenario? (Select all that apply),multi-select,They offer significantly lower prices compared to regular pay-as-you-go VMs,"Spot VMs use spare Azure capacity at deep discounts, often up to 90% off.",They can be evicted by Azure when capacity is needed elsewhere,"Azure can reclaim the compute capacity at any time, which is the trade-off for the lower price.",They are best suited for fault-tolerant and interruptible workloads,"Because they can be evicted, they are ideal for batch jobs, dev/test, and stateless applications.",They guarantee continuous availability and fixed capacity,Spot VMs offer no availability guarantees and are not suitable for mission-critical apps.,,,,,"1,2,3","Spot instances provide major cost savings but come with eviction risks, making them ideal for flexible, non-critical workloads.",Azure Architecture and Services
An organization runs predictable workloads and wants to forecast cloud spending over the next few years. How do Azure Reserved Instances help? (Select all that apply),multi-select,They provide discounted pricing in exchange for a 1-year or 3-year commitment,"By committing to long-term usage, organizations receive significant billing discounts over pay-as-you-go rates.",They allow organizations to forecast costs more accurately over time,Fixed pricing for the term of the reservation makes annual and monthly budgeting much more predictable.,They automatically scale resources up and down based on demand,"Scaling is a feature of VMSS and Autoscale, not a pricing/billing feature like Reserved Instances.",They lock in compute costs regardless of short-term price fluctuations,Reservations protect the organization from price increases during the commitment term.,,,,,"1,2,4","Azure Reserved Instances improve cost predictability by locking in discounted pricing for long-term, steady-state workloads.",Azure Management and Governance
